id,num_comments,subreddit,text,time_created,title
t3_caikn2,0,Jokes,"The teacher asks, ""Hey, what's your name?""

The little boy says he doesn't know, so the teacher tells him to go home and ask his family what his name is. The boy decides to ask his mom, dad, and brother what his name is.

The boy's mom was on the phone when he asked, "" Hey mom, what's my name?""

She answered, ""Shhhh!""

The boy then asks his brother who was watching Spider-Man, ""Hey, what's my name?""

""Spider-Man!"", his brother shouted.

The little boy's dad was watching football in the living room when the boy asked, ""Hey dad, what's my name?

""49, hit 'em hard!"", the boy's dad yelled.

The next day, the boy went to school where the teacher asked, ""So, what's your name?""

The boy answered, ""Shhhh!""

His teacher said, ""Who do you think you are?""

""Spider-Man!"", answered the boy

So after the boys parents were called into the school to discuss their son's disrespect with the principal, the boy's father said, ""So how many spankings do you need?""

&amp;#x200B;

""49 hit 'em hard!""",1562575927.0,A boy walks into kindergarten on the first day of school
t3_ca8cl1,1,Jokes,"The wife slowly hobbles up, places her right hand on the Television, and places her left hand on her arthritic shoulder. The man walks up as well, placing his left hand on the television and his right hand on his crotch. The wife then says, “you just don’t get it, do you?” The husband replies, “what do you mean?” The wife gives him a stern look and replies “The point of this is to heal the sick, not raise the dead!”",1562515112.0,"A man and his wife were watching a Christian healing program on the television when the host says to walk up to the set, put their one hand on the television and the other on the part of their body that needs healing."
t3_ca9ame,0,Jokes,"Lucky for me, the Judge gave me 30 years.",1562520091.0,"My doctor said I only had 30 days to live, so I killed him."
t3_ca9j1k,2,Jokes,"It’s Ok
His condition is stable",1562521260.0,A little kid swallows 6 plastic horses...
t3_ca91rr,2,Jokes,"A man walks into a rooftop bar and takes a seat next to another guy. “What are you drinking?” he asks the guy.

“Magic beer,” he says.

“Oh, yeah? What’s so magical about it?”

Then he shows him: He swigs some beer, dives off the roof, flies around the building, then finally returns to his seat with a triumphant smile.

“Amazing!” the man says. “Lemme try some of that!” The man grabs the beer. He downs it, leaps off the roof —and plummets 15 stories to the ground.

The bartender shakes his head. “You know, you’re a real jerk when you’re drunk, Superman.”",1562518868.0,A man walks into a rooftop bar and takes a seat next to another guy.
t3_cac1hf,1,Jokes,"The first one said:""My wife bought more toaster, but we don't even have thelectricity at home.""


The second one said: ""My wife bought a washing machine, but we don't have water nor electricity at home.""


The third one said: ""Mine is even worse. A few days ago, she went out with her girlfriends and she took two condoms with her,but she doesn't even have a
dick.""",1562533867.0,Three guys were talking whose wife is stupid.
t3_cacbn2,1,Jokes,they are in recovery.,1562535372.0,"To clarify: teachers are not ""off for the summer"""
t3_cabqmn,1,Jokes,"Operator: 911 what is your emergency?
Old Lady: I need to know the location of my heart. 
Operator: Ma'am that's not an emergency. But it's below your left breast.
Old Lady: Thank you. (Hangs Up)

20 minutes later.
Phone rings. 

Operator: 911 what is your emergency?
Young teen: Help it's my grandmother. She's been depressed. I think she shot herself. 
Operator: Please remain on the line. Can you see the entry wound? Where is it located?
Young teen: It's on her left knee. It's bleeding pretty bad though.",1562532346.0,Old lady calls 911.
t3_cabnhy,1,Jokes,"Dad: No, it’s as easy as 1,1,2,3.",1562531892.0,"“Dad, is the Fibonacci sequence hard to understand?”"
t3_caga3m,1,Jokes,AWOLNATION,1562558820.0,What’s trumps favorite music artist?
t3_ca884j,0,Jokes,When you get arrested for harrasing someone over the phone and police gives you one phone call,1562514425.0,What is temptation
t3_ca6eep,2,Jokes,"The barman says “get out!”

The bacteria say “don’t worry, we’re staph”",1562503199.0,"Two bacteria walk into a bar, then into the staff area."
t3_cab2yi,2,Jokes,"The most difficult person to tell was my former best friend, because every time I mention his mother he tries to choke me.",1562529019.0,My girlfriend died and I had to break the news to everyone.
t3_cajjin,0,Jokes,"Whitney, we have a problem.",1562583145.0,"what did Louis Armstrong say, when he landed on the moon?"
t3_ca7kg8,3,Jokes,I'm just posting while I wait for the kettle to boil!,1562510689.0,The kids next door have challenged me to a water fight...
t3_ca6urr,5,Jokes,It’s WRSA.,1562506317.0,There’s a more virulent form of MRSA going around
t3_cac3b6,2,Jokes,The man can't even stand up for himself..,1562534136.0,What's with all of the rude Stephen Hawking jokes??
t3_cacjnd,5,Jokes,He was So Yung.,1562536604.0,My Korean friend died this morning.
t3_ca9vxl,2,Jokes,"Man: Please help! I have severe diarrhea!




Doctor: Have you tried lemons?




Man: YES! BUT EVERYTIME I REMOVE THE LEMON, THE DIARRHEA STARTS AGAIN!",1562523028.0,A man goes to the doctor
t3_cab8xz,2,Jokes,The road back to Scotland,1562529845.0,What's the best thing about England?
t3_caa8gw,1,Jokes,Love meant nothing to her.,1562524762.0,I used to date a tennis player.
t3_ca6pyy,4,Jokes,"I told them she's a solid √-100

She's a 10 and she doesn't exist, just like my friends.",1562505397.0,My friends asked me to describe my girlfriend
t3_cabrk3,1,Jokes,Take one out,1562532475.0,How do you make a packet of cigarettes a cigarette lighter?
t3_ca740d,2,Jokes,"Thanks for the gold kind Granger!

Edit: Thanks for the galleon kind stranger!",1562507980.0,What did Harry say to Hermione when she lent him a galleon?
t3_ca0m9p,12,Jokes,"Applicant: That's right.

Interviewer: What's 250 times 467?

Applicant: 546320

Interviewer: That's wrong.

Applicant: How about that speed though?",1562458313.0,"In a job interview, the interviewer said: It says here you can calculate large numbers quickly."
t3_cad5cb,0,Jokes,Comatoast,1562539922.0,What food can you in eat in your sleep?
t3_ca533w,4,Jokes,"One says to the other, “What do you think about this mad cow disease?”
“What do I care?” says the other. “I’m a helicopter.”",1562492073.0,Two cows are standing in a field.
t3_ca997l,4,Jokes,Alien vs. Predator,1562519889.0,What do you call a Hispanic and a Priest fighting?
t3_ca75ar,15,Jokes,"Germany, 1938",1562508201.0,Quick question: When was the first Burning Man festival?
t3_cacaly,0,Jokes,me: [getting dick caught in zipper one last time],1562535219.0,coroner: [closing body bag]
t3_cac99d,0,Jokes,"God couldn’t find 3 wise men and a virgin. 

:: I’m Italian American I just heard this on my recent trip",1562535025.0,Why was Jesus not born in Italy?
t3_caaxil,0,Jokes,"When I tell you what it is, you'll kick yourself.",1562528255.0,There's a really obvious way to get people to bruise their shins.
t3_cac5zp,0,Jokes,The nomads.,1562534536.0,What type of people never get angry?
t3_ca1404,15,Jokes,It's my cake day!,1562461398.0,"If a wedding goes off without a hitch, did anyone get married?"
t3_cah9p2,11,Jokes,The President of the United States.,1562565744.0,What's the only full time job in the world that's held by a toddler?
t3_cacuy6,2,Jokes,The people seeing the potential danger decided to leave.,1562538297.0,A horse walks into a bar
t3_ca8cto,1,Jokes,Someone who stays up all night wondering if there really is a dog!!,1562515146.0,"What do you get when you cross an Agnostic, a dyslexic &amp; an insomniac??"
t3_cadrs3,2,Jokes,Police believe it's hiding in a room somewhere. Citizens are requested not to mention it.,1562543517.0,An elephant escaped from the zoo yesterday.
t3_caf37l,1,Jokes,"A Ranger decides one day that he wants to go gator hunting and make some boots, so he gets dressed and packs his gear. He then stops at a local tackle shop to get some bait and tips on where he would have the best luck. 

The shopkeep tells him where to go and sells him some bait and as the Ranger starts to leave he says: “I sent some Marines out that way a couple days ago and haven’t heard from them. Can you check on them while you’re out there?”

The Ranger agrees and sets out arriving at the bayou a short while later. 

As he’s setting up, he notices the two Marines a little ways from him, with a massive pile of dead gators next to them. 

He decides to greet the Marines but as he’s walking to them a giant gator leaps out of the water at one of them. The second Marine tackles it to the ground and shoves a knife through it’s jaw. 

The Ranger rushes over to check on them and asks if they’re okay when one of the Marines looks at the dead gator and says:

“Damnit! This one ain’t wearin’ boots either!”",1562551436.0,A Ranger goes gator hunting
t3_cadr24,0,Jokes,"A doctor and a builder fell in love with a woman. The doctor gave her flowers everyday and the builder started giving her apples everyday. The woman knew the doctor was giving her the flowers because he loved her but didn't understand why he stopped after the builder started giving her apples. She goes to confront him about it.

Woman: hey why did the doctor stop giving me flowers after you started giving me apples?

The builder smiles and says: an apple a day keeps the doctor away!",1562543396.0,Two people fighting over a woman
t3_cadqjq,3,Jokes,Girl Fieri,1562543313.0,What would Guy Fieri’s name be if he was a girl?
t3_cabw1m,0,Jokes,Ayyyye matey,1562533111.0,What did the pirate say on his 80th birthday?
t3_cabvcl,2,Jokes," She said, ""Sex! Sex! Sex! Free sex tonight!"" I said, ""Wow!"" Then her friend said, ""No, she means 666-3629.""",1562533021.0,I asked a Chinese girl for her number...
t3_cab1eb,0,Jokes,I advise you not to go to those three places again..,1562528801.0,I broke my leg in three places: My Doctor said.
t3_cabizg,1,Jokes,She wanted to say hello to the other side.,1562531248.0,Why did Adele cross the road?
t3_cailqn,0,Jokes,Waiting for the date tree to grow.,1562576193.0,What is the most difficult part about being a farmer?
t3_ca8fq6,2,Jokes,"A Chinese man imitating a phone ringing and answering the call.

""Wing, wing, arrow?""",1562515575.0,What has two wings and an arrow?
t3_caen6e,2,Jokes,He should be back any day now!,1562548746.0,My Dad went out for a minute to get a pack of e-cigs
t3_ca1ryp,9,Jokes,She’s still not talking to me,1562465738.0,"My wife asked if I could hand her her lipstick, I gave her a glue stick accidentally"
t3_cad6pn,0,Jokes,Luckily he’s dyslexic so we just buy him normal spaghetti,1562540137.0,My son won’t eat anything but expensive alphabetti spaghetti
t3_ca58q6,1,Jokes,"One morning, the Pope comes out of the Vatican and decides he wants to go for a drive. The Pope calls for a limousine, but when it arrives he tells the driver to get in the back, he’s going for a ride.

As he blasts down the road in his limousine he speeds past two motorcycle officers. One of the officers pulls over the limousine, and after a few minutes returns to his buddy.

“Did you give him a ticket?” 

“No.”

“Well, Why not?”

“He was too important.”

“Well, we’re told to give anyone a ticket, no matter who it is.”

“No, no, he was too important, I couldn’t.”

“Alright then, who was it?” 

“I couldn’t recognize him, but his driver was the Pope.”",1562493538.0,"Italian Police are told to give tickets to anyone, no matter how important"
t3_caegae,0,Jokes,"The bartender says, ""I'll have to see your money first."" 

""I'm broke,  but if you give me a bottle of whiskey, I'll get up on that stage and fart Dixie!"" 

The bartender had never seen someone fart any kind of song, so he agrees. 

The Cowboy drinks the whole bottle of whiskey, then staggers up on stage and the audience start applauding. Then he drops his pants and the audience start cheering even louder. 

Then, he proceeds to shit all over the stage, and everyone gets disgusted and leaves. 

The bartender screams, ""You said you were gonna fart Dixie! Not shit all over my stage!"" 

And  the Cowboy replies, ""Hey! Even Frank Sinatra had to clear his throat before he sang!"" ",1562547585.0,"A broke dirty Cowboy walks into a bar and says, ""Gimme whiskey."""
t3_ca8wfz,0,Jokes,"""So how did it go ?"", he asked.

The person on the other side of the line said, ""We've got four out and expect to have the rest out before lunch. The last one was a duck.""",1562518101.0,A man called the hospital where his pregnant wife was admitted. He was accidentally connected to the Lord's Cricket Ground.
t3_ca9c0f,2,Jokes,Canadian Club on the Rocks.,1562520286.0,What is a baby seal’s favourite drink?
t3_cab67f,0,Jokes,"One farts, the other one says ‘ugh! Do you mind I’m eating’",1562529466.0,2 flies sitting on a turd.
t3_ca8uv4,3,Jokes,"The horse replies ""I just found out I've got AIDS.""",1562517866.0,"A horse walks into a bar... The barman asks ""Why the long face?"""
t3_cagjy9,0,Jokes,"Because I found a rubber band


Credit to Spider-Man 2",1562560645.0,Has anyone lost a large roll of $100 bills in a rubber band?
t3_caeals,1,Jokes,The ceiling; has a lot of fans.,1562546611.0,What part of the house is usually the most famous?
t3_cagh0x,1,Jokes,Photosynthesis.,1562560092.0,Don’t you just hate it when people use big words to sound
t3_cacvqx,1,Jokes,Give me your liver.,1562538424.0,A duck walked up to a lemonade stand and he said to the man running the stand
t3_cacuoi,0,Jokes,It should be called “El Dora-do”.,1562538254.0,They missed an opportunity naming the movie “Dora and the Lost City of Gold”.
t3_cae3yo,0,Jokes,I’ll trip another 100 and report back,1562545525.0,I’ve been performing a scientific study on toddlers. When they trip and smash their heads they sometimes cry; but other times they jump right back up laughing. I can’t figure out a pattern that explains the difference in behaviour. Maybe my sample size is too small for accurate results.
t3_cae3vi,1,Jokes,Found out I have dailysex,1562545509.0,Went to my dyslexia assessment earlier on today
t3_cabn1e,1,Jokes,"It’s really tasty, it goes well with salad.",1562531829.0,You’ve heard of Newton’s Laws but have you heard of Cole’s Law?
t3_ca9dcf,0,Jokes,He did Cross Fit,1562520480.0,Why do you never see a fat Jesus?
t3_c9pjct,308,Jokes,It is actually the San Andreas's fault.,1562387879.0,I keep hearing people say these SoCal earthquakes are being caused by the heat or as punishment for how we have been acting. I think they are wrong.
t3_cabif7,0,Jokes,"Sitting in the chair she turns to the doctor and says “Every time I prod my body, it hurts. I could prod my arm, my leg and even my head and it’ll really hurt”

Intrigued the doctor examines her and smiles. He turns to the woman and says “You’ve broken your finger”",1562531171.0,A blonde woman goes to the doctors
t3_cadyvx,0,Jokes,Toucan.,1562544684.0,How many birds can screw in a lightbulb?
t3_cag4px,1,Jokes,"More specifically, extremism.",1562557881.0,I don’t care for all these isms flying around these days
t3_ca97fv,2,Jokes,They could never keep control of their pupils.,1562519641.0,Just found out that my old math teacher was cross-eyed.
t3_cacgx4,1,Jokes,They will chose the sixth one,1562536185.0,Give women five choices...
t3_ca7wnu,3,Jokes,A pho'dog'rapher.,1562512629.0,What do you call someone that takes pictures of only dogs?
t3_cag2gg,0,Jokes,I HAVE HAD IT WITH THESE MOTHERFUCKING SNAKES ON THIS MOTHERFUCKING PLANE!,1562557466.0,I am fed up of my coworker joking about Oedipus's serpent on his aircraft.
t3_cag1vy,1,Jokes,in the toilet   (joke courtesy of my grandmother),1562557360.0,where does a stool stay
t3_cag1gx,2,Jokes,The Vault-cano,1562557280.0,Where did the guy plan to hide his vault?
t3_ca268q,5,Jokes,When it reigns it pours.,1562468367.0,Why did the King take a second job as a bartender?
t3_cab8c5,0,Jokes,KillHalfOfTheUniverseWithASnapinator,1562529760.0,What is the name of Dr Doofenshmirtz Infinity Gauntlet?
t3_cab4cy,1,Jokes,"Never stop believing in yourself.

Gonna see your dreams become reality.

Give it your best every day.

You will achieve it if you believe it and you'll go.

Up up and away you'll forever succeed.






To memorize this I find it easier to memorize the first word of every line.",1562529215.0,Motivation to live by and memorize.
t3_cafum1,0,Jokes,"If it moves, it's not a mailbox.",1562556092.0,Be careful when sending letters in Saudi Arabia.
t3_caftxf,0,Jokes,The guy was talking alot of shit before the fight so I'd say he's Ben Askren for it,1562555972.0,There was a crazy knockout in the ufc last night
t3_c9wh3b,24,Jokes,"The patient answers, ""Give me the lawyer's heart, that one hasn't been used yet.""",1562435676.0,"The surgeon tells a patient who needs a heart transplant, ""You are in luck, we have two matching donors. A twenty year old athlete and an 80 year old lawyer, which heart do you want?"""
t3_caa432,0,Jokes,She guzzles down loads of pills and then gets killed by ghosts.,1562524162.0,"Come to think of it, Miss Pac-Man is a lot like my mother."
t3_cadhkh,0,Jokes,Martyrmen,1562541869.0,What does ISIS call their indirect fire weapons systems operators?
t3_cafp96,2,Jokes,What's on?,1562555176.0,I met Sherlock Holmes once but he kept asking the same question over and over.
t3_ca5oqf,2,Jokes,"Every day I would take ripe vegetables to the farmers market and sell them.
Potatoes, carrots, eggplants, and so on.
One day the cops arrested me for public urination.
Apparently, you can't take your peas and leaks in the public.",1562497458.0,I have a beautiful garden in my backyard where I grow vegetables.
t3_caau0a,2,Jokes,Then I remembered that I found the Riyal joke in the comments,1562527785.0,"There's this amazing joke about Saudi Arabia's currency, but I forgot where I heard it"
t3_cade25,2,Jokes,But he beat me to it.,1562541304.0,I was about to post a joke about my abusive father...
t3_ca8h2r,0,Jokes,Mayo neighs.,1562515779.0,I have a horse called Mayo.
t3_cafgia,1,Jokes,Pogo dick.,1562553675.0,How does a person with no limbs get around?
t3_ca5a74,2,Jokes,the K is silent.,1562493918.0,I just checked my bank account balance and I have $10K
t3_ca2a59,10,Jokes,Dick,1562469097.0,What do gay horses eat?
t3_ca2xbb,3,Jokes,"She tells the pharmacist she needs some cyanide. 

""Why in thr world would you need cyanide??"" He asks.

The woman explains that she needs it to kill her husband. 

The pharmacists eyes get big-- ""Good Lord!! I can't give you cyanide to kill your husband! It's against the law! I will lose my license and they will throw us both in jail! Just leave and forget you ever came in here before I call the police!"" 

The woman then reaches into her purse and pulls out a picture of her husband in bed with the pharmacists wife. The pharmacist looks at the pictures and says-- ""Well now, you didn't tell me you had a prescription.""",1562473518.0,A woman walks into a pharmacy...
t3_cacwrs,0,Jokes,Because they demonstrated his third law. (Told by my nine year old son with accompanying fart for emphasis),1562538577.0,Why did Isaac Newton love beans?
t3_caf6r8,5,Jokes,The US men's team haven't won in the entire history of the sport.,1562552035.0,Why is the US women's soccer team mad about equal pay compared to the men's side?
t3_ca2ize,4,Jokes,So I packed my stuff and right.,1562470752.0,My wife thinks I have no sense of direction
t3_caf6q1,0,Jokes,"At the time, there were two capital offenses in Texas, murder and horse thieving. After a while, the man notices that the judge frequently commuted the sentences of murderers, but never horse thieves. One day, he asks the judge about this, and the judge says “Boy, some men need killing, but I ain’t never seen a horse that needed stealin’.”",1562552028.0,A young east coast lawyer goes to clerk for a Texas judge.
t3_ca3kv1,4,Jokes,A thot,1562478510.0,What do you call a slutty idea?
t3_ca2dzz,3,Jokes,"
A sweet and innocent young Italian girl gets married, but the girl's mother lives downstairs. The girl has never made love to a man before, and on their wedding night, when he takes off his shirt, she goes running downstairs.""Momma, Momma,"" she cries. ""I can't believe it! He has hair all over his chest ! What should I do ?""

The mother is making spaghetti sauce. She stirs the sauce thoughtfully and says, ""Hair on his chest ? He's your husband, it's your wedding night, go upstairs.""

When the girl gets back upstairs, the man takes off his pants. This sends her running back down to her mother:""Momma, Momma! He has hair all over his legs! What should I do?”The mother stirs the sauce thoughtfully and says: ""Hair on his legs? He's your husband, it's your wedding night, go upstairs.""

The girl goes back upstairs, and the man takes off his shoes and socks. She looks down and sees that half of one of his feet is missing. She goes crying back down the stairs:""Momma, Momma! He's got a foot and a half! What should I do?""

The mother hands her daughter the spoon and says:  

""A foot and a half? Here, you stir the sauce. I'll go upstairs",1562469817.0,Stirring the Sauce
t3_cab9yi,2,Jokes,Boo-bees,1562529992.0,What are the best kind of bees?
t3_c9uiad,47,Jokes,38 Cent,1562425274.0,What do you call a female rapper?
t3_caa386,0,Jokes,Because World War 2 was a big game of cat and mouse,1562524039.0,Why were the Germans called Jerrys?
t3_ca3pag,8,Jokes,You can hide but you can’t run,1562479507.0,To the guy in the wheelchair who stole my camouflage jacket…
t3_ca63g7,1,Jokes,"You FOOLS.

LA IS THE EARLY WARNING SYSTEM.",1562500863.0,People in LA are complaining that the early warning system didn't work.
t3_caa1ye,4,Jokes,"...his head was covered with nuts, sprinkles &amp; chocolate sauce.

**police:** ...*he was an ice cream man, we have reason to believe he may have topped himself*!",1562523868.0,...police found man dead!
t3_ca5en1,1,Jokes,A Brazilian,1562494986.0,How many South Americans does it take to change a lightbulb?
t3_ca9x7t,0,Jokes,But the guy claimed no such shade existed. It must have been a pigment of my imagination.,1562523204.0,I went to the paint store to ask for a shade
t3_ca48nl,2,Jokes,"around 9:58 pm.  He sits down next to this blonde at the bar and stared up at the TV as the 10:00 news came on. The news crew was covering a story of a man on a ledge of a large building preparing to jump.  

The blonde looked at the man and said,  ""Do you think he'll jump?"" 

The man says, ""You know what, I bet he will.""  The blonde replied, ""Well, I bet he won't.""  The man placed $30 on the bar and said, ""You're on!""  

Just as the blonde placed her money on the bar, the guy did a swan dive off of the building, falling to his death.  The blonde was very upset and handed her $30 to the man, saying, ""Fair's fair... Here's your money."" 

The man replies ""I can't take your money, I saw this earlier on the 5 o'clock news and knew he would jump.""  

The blonde replies, ""I did too;  but I didn't think he'd do it again.""",1562484154.0,A man walks into a bar...........
t3_caemzh,0,Jokes,I’ve been pressing my belly button for 2 hours now!,1562548712.0,The games say press any button to start buts it broken.
t3_c9wsmh,22,Jokes,and many other words as well.,1562437332.0,My pen can write underwater
t3_ca1d85,7,Jokes,"I was relieved when she said, “Sorry, wrong number.”",1562463048.0,My girlfriend texted me that we were breaking up.
t3_c9q1u0,56,Jokes,He was running a huge pyramid scheme.,1562391581.0,How did the pharaoh get so rich?
t3_ca3ti5,2,Jokes,"Walking

JK Rolling",1562480472.0,What’s Harry Potters favorite way of getting down the hill?
t3_caef8k,0,Jokes,"He must be happy knowing that no one who has ever died has been as much appreciated for his work.

At his funeral every single botox patient showed up and expressed no emotions.",1562547410.0,A successful surgeon passed away suddenly.
t3_caafrv,3,Jokes,Their flag is a big plus.,1562525798.0,I'm thinking about moving to Switzerland.
t3_cac04r,0,Jokes,Grassy ass,1562533674.0,What do you say to your abuela for washing your soccer shorts?
t3_ca2w0v,7,Jokes,"Of course you can, I just wanted to make you smile!",1562473255.0,You can’t breath through your nose while smiling.
t3_caabvj,1,Jokes,"In the biblical sense.

And by that I mean made up women that don't really exist.",1562525248.0,I have been with LOTS of women
t3_ca503x,6,Jokes,Sounds like something an asshole would do.,1562491310.0,Anal bleaching
t3_ca5kgv,4,Jokes,"One of them finds a hair in the steak and calls the waiter to say:
“Waiter there’s a hair in my steak!” 
The waiter nods and says “That’s because the chef uses his armpits to mash the meat”
“That’s disgusting” says the indignant diner
To which the waiter replies “You should see how he makes the doughnuts”",1562496441.0,A couple we’re having dinner at a restaurant
t3_ca3srw,4,Jokes,You Poker Face.,1562480297.0,How do you wake up Lady Gaga in the morning?
t3_cabs2q,0,Jokes,That even her pounds ran away from her,1562532551.0,Yo mamma so annoying
t3_ca7hyi,1,Jokes,It hasn't been laid yet.,1562510295.0,Have you heard the joke about the Virgin yet?
t3_ca4rvj,3,Jokes,But it turned out to be a pain in the ass.,1562489187.0,I thought I’d found my dream job as a male prostitute
