id,num_comments,subreddit,text,time_created,title
t3_avxog7,135,Jokes,"Over 10k members!  Come see reposts in real time!  

https://discord.gg/jokes ",1551396843.0,r/jokes has a discord and you need to join!
t3_cac8uf,357,Jokes,"Suddenly, armed men storm in and try to rob the bank. A shootout occurs and the woman is hit by bullets several times.

Shortly after, the woman is brought to the hospital and gets emergency surgery. The surgeon is able to remove all bullets except three due to endangerment to the triplets. 

The woman gets well soon and gives birth to three healthy triplets, two girls and one boy. The incident at the bank gets forgotten over the time.

Fourteen years later, one of the daughters comes to her mother, obviously upset: ""Mommy, mommy!""

M: ""What's the matter, sweetie?""

D: ""I had to pee, but there was a 'pling' and I found a bullet in the bowl. ""

M: ""Don't worry, this won't happen again."" 

One week later, the second daughter runs to her mother, upset: ""Mommy, mommy!""

M: ""What's the matter, sweetie?""

D: ""I had to pee, but there was a 'pling' and I found a bullet in the bowl. ""

M: ""Don't worry, this won't happen again."" 

Another week later, the son comes to his mother, also upset: ""Mommy, mommy!'

M: ""What's the matter, sweetie? No, wait, let me guess. You had to pee and found a bullet in the bowl?"" 

S: ""No, but I was jerking off and shot the cat!""",1562534963.0,A woman pregnant with triplets walks into a bank.
t3_ca6guc,305,Jokes,"He said, “No. Fatty, don’t eat anything.""",1562503685.0,"I went to the doctors recently He said: “Don’t eat anything fatty” I said: “What, like bacon and burgers?”"
t3_cagj2u,22,Jokes,"Deer balls, they’re under a buck...

(Told to me by my 12yo son)",1562560481.0,What’s the cheapest meat you can buy?
t3_cahjb4,11,Jokes,They did unspeakable things to me.,1562567705.0,As a child i was molested by mimes
t3_cafu2j,6,Jokes,"
It was motherfucking gold.",1562556006.0,A coworker told me a joke about Oedipus and King Midas today.
t3_ca5s9m,158,Jokes,"

The boy coughs up two of the pennies, but keeps choking.

Looking at his son, panicking, the father starts shouting for help.

A well dressed, serious looking woman, in a blue business suit is sitting at a nearby table reading from her laptop and sipping a cup of coffee.

At the sound of the commotion, she looks up, puts her coffee cup down, gets up from her seat and makes her way, unhurried, across the restaurant.

Reaching the boy, the woman carefully drops his pants, takes hold of the boy’s testicles and starts to squeeze and twist, gently at first and then ever so firmly.

After a few seconds the boy convulses violently and coughs up the last penny, which the woman deftly catches in her free hand.

Releasing the boy’s testicles, the woman walks back to her seat at the coffee bar without saying a word, but keeps the penny.

As soon as he is sure that his son has suffered no ill effects, the father rushes over to the woman and starts thanking her saying, “I’ve never seen anybody do anything like that before, it was fantastic. Are you a doctor?”

“No,” the woman replied. “I’m with the Internal Revenue Service.”",1562498300.0,"A father and his young son go to a restaurant and to keep him occupied, he gives the boy three pennies to play with. Suddenly, the boy starts choking and his face starts turning blue! The father realizes the boy has swallowed the pennies and starts slapping him on the back..."
t3_ca90a2,83,Jokes,"The friend doesn't like it but being a buddy, he agrees. After mass, 

Bob starts talking to the priest, asking him all sorts of stupid questions, just to keep him occupied. Finally the priest gets annoyed and asks him what he's really up to. 

Bob feeling guilty, finally confesses to the priest... 

""My friend is sleeping with your wife right now, so he asked me to keep you occupied.""

The priest smiles, puts a brotherly hand on Bob's shoulder and says... 

“You better hurry home now, my wife died a year ago""",1562518656.0,"Jack goes to his buddy Bob and says ... ""I'm sleeping with the priest's wife. Can you hold him in church for an hour after mass for me?"""
t3_cah9z5,9,Jokes,I looked so much younger then.,1562565792.0,I watched my first porno film last week....
t3_ca79ej,59,Jokes,"I thought, “I don’t have time for this shit.”",1562508901.0,"I was sitting on the toilet, exhausted, and late for work."
t3_ca7dqi,38,Jokes,"The doctor tells him he will give him a dick transplant. He loses his 3-foot-long dick for a 4-inch-long dick. 

He comes back in a week and says, ""Now my wife wont have sex with me. May I have the old one back?"" 

The doctor replies... ""A d-d-d-deal's a d-d-d-deal.""",1562509646.0,"A man comes to the doctor and says, ""m-m-m-my d-d-dick is so pressurized that I st-st-stutter."""
t3_cai4bj,5,Jokes,fuck off,1562572109.0,Do you like sex and travel?
t3_cag1vo,10,Jokes,"When suddenly the horse falls into a mud hole. The pig and chicken freak and they don’t know how they will get their friend out.

So the pig and chicken run up to the farmers house and they bang on the door, no answer... again they bang on the door, no answer.

In a fury the chicken busts down the door and grabs the keys to the Mercedes parked out front. Then the two of them grab some rope.
The pig then drives down to the mud hole and attaches one end of the rope to the horse and the other to the bumper. 

The pig then pulls the horse out with the Mercedes.

The next day, the three of them are walking again and the chicken falls into the same hole.
The pig begins to say “I know what to do!” and begins to run back to the house, but the horse stops him and says “hold on, watch this”.

The horse then steps over the mud hole and says to the chicken, “grab hold of my penis”. The chicken complies as he doesn’t want to die in the mud hole and grabs hold of the penis and the horse pulls him out.

The moral of the story is, when you’re hung like a horse, you don’t need a Mercedes to pick up chicks.",1562557359.0,"A horse, chicken and a pig are out walking on a farm..."
t3_cacwo0,18,Jokes,These are the pie rates of the Caribbean.,1562538563.0,A slice of pie is $2.50 in Jamaica and $3.00 in the Bahamas
t3_caiard,3,Jokes,"“Marco!”







“Polio!”",1562573604.0,So an Anti Vax kid was playing in the pool...
t3_cahqjm,18,Jokes,He asked them who the best composer was and didn’t like their answer.,1562569214.0,Why did Mozart get rid of all his chickens?
t3_ca7i4x,18,Jokes,"Two Army boys, Leroy &amp; Jasper, from the hills of Kentucky were promoted right from privates to Sergeants because of their great marksmanship with rifles. 

Not long after, they're out for a walk and Leroy says, ""Hey, Jasper, There's the NCO Club. Let's you and Me stop in."" ""But we's privates,"" protests Jasper. ""We's sergeants now,"" says Leroy, pulling him inside. ""Now, Jasper, I'm a gonna sit down and have me a drink."" ""But we's privates,"" says Jasper. ""Are you blind, boy?"" asks Leroy, pointing at his stripes. We's sergeants now, so hush your mouth!"" 

So they have their drinks and pretty soon a hooker comes up to Leroy. ""You're cute,"" she says, ""and I'd like to date you, but I've got a bad case of gonorrhea."" ""Leroy pulls his friend to the side and whispers, ""Jasper, go look in the dictionary and see what gonorrhea means. If it's okay, give me the okay sign."" 

So Jasper goes to look it up, comes back and gives Leroy the big okay sign. Three weeks later Leroy is laid up in the infirmary with a terrible case of gonorrhea. 

""Jasper,"" he says, ""why did you give me the okay sign?"" 

""Well Leroy, in the dictionary, it says gonorrhea affects only the privates."" He points to his stripes. ""But we's sergeants now!""",1562510321.0,"Two army boys, Leroy &amp; Jasper...."
t3_caivb2,3,Jokes,"He calls the Programm ""Hearing Aids""",1562578229.0,A man says he can detect HIV just by listening To it
t3_caheph,2,Jokes,Together we can stop this shit,1562566754.0,What did one butt cheek say to the other?
t3_ca9ev1,9,Jokes,"The man nudges his friend and says, ""See that kid? He's got to be the stupidest kid in the whole wide world. Watch this.""

He walks up to the kid as his friend watches, and holds out a five dollar and a ten dollar bill. ""Hey kid, pick one.""

The kid looks between the notes and eventually takes the five dollar bill. The man laughs and pockets the other note and walks back to his friend, still laughing.

""See what I mean?"" he says, shaking his head. ""Every damn time. Stupid kid never learns.""

His friend is puzzled, but doesn't say anything. Later in the evening he decides to take a stroll alone and spots the boy again. Curiosity overcomes him, and he goes over and asks, ""Hey kid, why do you keep taking the five dollar bill every time?""

""Because, mister, the day I take the ten dollar bill, the game ends.""",1562520699.0,A man is showing his friend around his town. They pass a boy selling newspapers on the side of the road.
t3_ca1mj1,379,Jokes,None. They just compliment it and then get mad when it won't screw.,1562464750.0,"How many ""friend zoned"" guys does it take to change a light bulb?"
t3_cafdla,5,Jokes,I was crock blocked.,1562553190.0,My wife and I were trying to have sex when the slow cooker set off the fire alarm.
t3_cainj3,3,Jokes,Juan Direction,1562576578.0,What do you call a mexican gps?
t3_cad3em,8,Jokes,Because her O varies.,1562539610.0,Why is a woman's orgasm so much different from a man's?
t3_cajico,2,Jokes," He puts a dollar in the slot and enters. There is a jogging track with a beautiful naked woman wearing jogging shoes. ""Better start running"" she says, beckoning him. Excited, he chases her around the track for an hour. Finally he catches her, she... ahem... rewards him... then he steps on the scale. He lost 1 pound!

As he leaves he sees a new sign next door. ""Lose 2 pounds for $2"". He pays, enters. This time there are two gorgeous naked women in running shoes. They say ""Better start running."" He does, chasing them around the track. Two hours later he catches them. He is doubly... rewarded. On his way out the scale shows he lost 2 pounds!

The man leaves. Sure enough, next door there is a final sign: ""Lose 3 pounds for $3."" By now the fat man is exhausted and can barely walk... but he cannot resist. He pays and enters. The door slams shut behind him and locks.

Alone on the running track is a 6'4"" muscular male body builder, naked except for running shoes. The naked athlete points down at his enormous erection, smiles at the fat man and says...

""Better start running.""",1562582918.0,A fat man sees a sign on a door: lose 1 pound for $1...
t3_caetoy,7,Jokes,"As a singer I sing at many funerals &amp; I was recently asked by a funeral director to play &amp; sing at a graveside service for a homeless man.  He had no family or friends, so the service was to be at a pauper's cemetery out in the country.  As I was not familiar with the area, I got lost.  I finally arrived an hour late and saw that the funeral guy had evidently gone and the hearse was nowhere in sight.  There were only the diggers and crew left and they were eating lunch.  I felt badly and apologized to the men for being late.  I went to the side of the grave and looked down and the vault lid was already in place.  I didn’t know what else to do, so I started to play.  The workers put down their lunches and began to gather around.  I played out my heart and soul for this man with no family and friends.  I sang  like I’ve never played before for this homeless man.

As I sang &amp; played “Amazing Grace”, the workers began to weep.  They wept, I wept, we all wept together.  When I finished, I packed up my keyboard and started for my car.  Though my head hung low, my heart was full.

As I opened the door to my car, I heard one of the workers say, “I’ve never seen nothin’ like that before and I’ve been putting in septic tanks for twenty years.” Apparently, I’m still lost….",1562549862.0,Late to a funeral
t3_ca1c1c,192,Jokes,"Thanks for the gold kind stranger!

Edit:Thanks for the gold kind stranger!",1562462837.0,What did the Nazi dentist say on reddit?
t3_cajo45,0,Jokes,The Cure.,1562584058.0,What band do Anti-vaxxers refuse to listen too?
t3_ca70e6,22,Jokes,A rabbyte.,1562507318.0,What do you call a group of 8 rabbits?
t3_cactkf,3,Jokes,It got so out of hand we had to take his bike away.,1562538088.0,I had a dog that used to chase people on a bike
t3_caiezw,6,Jokes,A Haudi,1562574610.0,What type of car does a cowboy drive?
t3_cahjqn,2,Jokes,His jokes would never get old,1562567796.0,Peter Pan would make a great comedian
t3_cahcml,4,Jokes,"Then the waiter came over and asked, ""Why are these coins wet?""",1562566337.0,I told my girlfriend to lick the tip.
t3_cajoss,1,Jokes,How do you ruin a joke?,1562584196.0,Mess up the formatting
t3_cah8rt,1,Jokes,"One of my friends is forging a bold new path for himself, and eschewing the conventions of normal life, here's a tale he told me that illustrates his attitude...

 'I haven't got a computer, but I was told about Facebook and Twitter and am trying to make friends outside Facebook and Twitter while applying the same principles.

Every day, I walk down the street and tell passers by what I have eaten, how I feel, what I have done the night before and what I will do for the rest of the day. I give them pictures of my wife, my daughter, my dog and me gardening and on holiday, spending time by the pool. I also listen to their conversations, tell them I ""like"" them and give them my opinion on every subject that interests me... whether it interests them or not.

And it works. I already have four people following me: two police officers, a social worker, and a psychiatrist.'",1562565546.0,Social media In real life.
t3_ca93au,3,Jokes,"They each take one and go into their neighboring hotel rooms.

Things were getting hot and heavy but one of them couldn't get a woody. He felt a lot more insecure when he could hear his buddy yelling ""here I come! 1-2-3!!! Almost there! Let's go again.""

The next morning at breakfast he was telling his friend how embarrassed he was that he couldn't get hard. Then his friend says ""hey man, I couldn't even get on the bed!",1562519071.0,Two midgets decided to get prostitutes.
t3_cahf2y,1,Jokes,"I'm holding interviews for the new vacancy if anyone's interested.

Full-time, permanent basis.

Contact me via email.",1562566832.0,"My ex left me because I'm ""too much of a corporate scumbag""."
t3_cag6o8,3,Jokes,They don't know their ass from a hole in the ground.,1562558229.0,Some people don't know whether to use the word 'burro' or 'burrow'
t3_cael80,3,Jokes,I guess it's time for me to retire.,1562548412.0,At age 70 I participated in my first demolition derby today and my tires flew off my car.
t3_cajmfb,3,Jokes,"He had a wild, bold, and crazy personality and sense of humor. He knew he would be hilarious if he just had the opportunity to get in front of a crowd.
 

So Bob the ant went around town auditioning for gigs. He let his crazy attitude go full force at the judges. They weren’t too impressed, but one venue offered him a gig for next Saturday night.
 

Bob, disappointed he didn’t get the judges to laugh as much as he wanted, shakes his head at it and reassures himself it’s a fluke and he will rock the crowd on Saturday.
 

Saturday rolls around and Bob is next to go on stage. He gets up there and starts. His act is insane and wacky. Bob the ant is going nuts. But the crowd isn’t laughing. Disappointedly, Bob walks off stage to the audience after his set to reflect on why he wasn’t so funny. As he does this, the next ant comedian walks on stage. His name is Tom, and Tom has a much more relaxed and chill vibe to him than Bob. Tom is killing it. Every sentence makes the crowd roar with laughter.

 
Confused, Bob asks the manager of the club who happened to be sitting next to him, “Hey, what makes that guy so much more funny than me?!” To which the manager replied, “The real joke is in the calm ants”

Edit formatting",1562583739.0,Bob the ant wanted to be a stand-up comedian
t3_caah5t,9,Jokes,"I guess, but I still wish she didn't have one.",1562525999.0,My girlfriend keeps telling me having a small penis isn't that much of a problem.
t3_cagzy9,3,Jokes,Because it got mugged.,1562563759.0,Why did the coffee file a police report?
t3_caif34,1,Jokes,"And see’s his wife’s clothes sprawled all over the  house, surprised and confused, he rushes for his bedroom and see’s her butt naked on their bed with a suspicious look on her face. Alright, where is he? He asks. Furious, he starts throwing a fit and searches every nook and crack to no avail. Suddenly, he hears the apartment door open from below their balcony, and he see’s a guy buttoning up a shirt, whistling with a smug look on his face. He looks at his wife and says, that’s the fucker isn’t it?! Before he lets her speak he runs for the fridge, picks it up and gives it a sprint and a fat lunge off the balcony, landing it on the guys head killing him instantly. Unfortunately, during the process, he had slipped and fell to his death as well. 3 guys end up at heavens gates standing in line together waiting for St. Peter and one of the guys decided to strike up a conversation, so what brought you here? Other dude replies, well i was starting off to what i thought was a great day, and as i’m walking towards my car to get groceries for my family, it starts raining appliances and welp, here i am! Other guy puts his hand behind his neck with a regretful look on his face and says, yeah my bad man, that was me. I threw it at you thinking you were sleeping with my wife, but hey i ended up paying for that mistake obviously. The two of them hug it out, look at each other, then look at the third guy. He notices their attention and says, yeahhhh...I was in the fridge.",1562574631.0,One day a husband comes home early from work...
t3_cadq5y,4,Jokes,And now she's just starting to sound like my wife,1562543248.0,My girlfriend started to accuse me of cheating yesterday
t3_c9zkzp,97,Jokes,"The bartender asks: “What can I get you?” 
The construction worker says “One beer for me, and one for the road.”",1562452211.0,A construction worker walks into a bar with a slab of asphalt.
t3_ca6qo6,23,Jokes,"1st Child: Mom, how was I named?

Mother: Well, when your father and I were walking out of the hospital, a lily fell on your head. So we named you Lily.

Lily: That’s so cool!

2nd Child: Mom, how was I named?

Mother: Well, when your father and I were walking out of the hospital, a rose fell on your head. So we named you Rose.

Rose: That’s so cool!

3rd Child: guguhu sjebe kddekw?

Mother: What did you say, Brick?",1562505542.0,Kids ask their mother how they were named
t3_caaza9,15,Jokes,I think,1562528504.0,I was gonna make a joke about memory loss
t3_caiuz8,0,Jokes,A receding hare line.,1562578161.0,What do you call a group of rabbits walking backwards?
t3_caitgh,6,Jokes,"His hair's a mess, his family is nuts, his neighbor's an asshole, his best friend's a pussy, and his owner beats him.",1562577829.0,A dick has a sad life.
t3_ca98cu,16,Jokes,"I don’t know why he was mad, maybe because she was wearing them, or because his whole family was watching. Either way it made her funeral a bit awkward.",1562519771.0,My friend got mad when he caught me smelling his sister’s panties.
t3_caf199,5,Jokes,He said that he liked it well done.  I said thanks.,1562551117.0,I cooked my friend a perfect medium rare steak.
t3_cahg0c,2,Jokes,"An Aussie saying""we're men"".",1562567007.0,Women.
t3_ca25uh,36,Jokes,"The boy replies, “I’m an orphan, your honor.”",1562468293.0,A boy is about to be sentenced for killing his parents. He begs the judge to spare his life. The judge asks for one good reason he should be shown any mercy.
t3_cabpn4,12,Jokes,rip,1562532197.0,A guy died when he was torn in half.
t3_cajqcu,1,Jokes,"When you're alone, it cums in handy.",1562584489.0,I'm a fan of masturbation
t3_caf6wx,0,Jokes,"She frantically telephoned the police at once and reported the crime. The police dispatcher broadcasts the call and a K-9 unit patrolling nearby was the first to respond.
As the K-9 officer approached the house with his dog on a leash, the blonde ran out on the porch, shuddered at the sight of the cop and his big dog, and sat down on the steps and started crying. 
Putting her face in her hands, she sobbed: ""I come home to find all my possessions stolen. I call the police for help, and what do they do? They send me a BLIND policeman!""",1562552063.0,"Returning home from work, a blonde was shocked to find her house ransacked and burglarized."
t3_cagqh4,4,Jokes,It's all shits and giggles until someone giggles and shits.,1562561894.0,I made spacecake with laxatives for my birthday.
t3_caht3b,0,Jokes,"The bartender asks, ""Why so many shots, what's the occasion?""

The man replies, ""My first blowjob!""
 
The bartender asks the man, ""Oh? How was it?""

The man says ""It was alright but I can't get the taste out of my mouth.""",1562569730.0,A man walks into a bar and orders 5 shots of bourbon
t3_caejab,3,Jokes,"Doctor: Well you should eat more greens
Me: ok

(Gets home) 

Well time to dye all my burgers green

(Next check up)

Doctor: what the hell happened 
Me: I went on a dye-it",1562548088.0,Doctor told me to eat more greens
t3_cajiln,0,Jokes,I will be crowd saucing.,1562582965.0,I’ve invented a machine that sprays ketchup over large groups of people but I need financial investment to get the business up and running.
t3_cagwjk,6,Jokes,The jokes not here it's in your hand.,1562563071.0,Written above a urinal.
t3_cafkcu,3,Jokes,"An esteemed hero of all men approaches Olympus and thinks hey, why the hell not. If I lose I may be disappointed, but if I win I will join the legendary Gods of the Pantheon!
  

So he makes his way to Zeus, excited to see what is in store for him in order to prove his worth to the Gods. Along the way, he sees dozens of noble warriors, bodybuilders and others laying on the ground, devastated. Their absolute and utter exhaustion is displayed clearly by the pools of sweat underneath them, and the sound of wheezing could be heard from over 50 yards away. The hero is now concerned, these men appear to be very strong and fit, but he is more so than all of them. A ways further and he sees Hercules, Chuck Norris, and even Atlas, who held up the sky for countless years, receiving medical attention for their hands which are shaking uncontrollably. The hero is extremely worried, and heavily considers turning back. If these great men could not best the challenge of strength, then how could I? But the prospect of becoming a god was too tempting, and he pressed forward.
  

The hero had finally reached Zeus who was holding a jar of peanut butter. ""Welcome, great hero. If you wish to become a god you must complete 4 feats of strength. Here is a jar of peanut butter. Please open the jar without using any hot water."" The hero took the jar, and while tight, presented no challenge as he opened it without a grimace.
  

""Very good"" says Zeus. ""For the next challenge, you must carry 8 bags of groceries in one trip, without dropping any or breaking the eggs."" As a man, the hero has done this countless times before, so he was not particularly worried. He picked up 4 in one hand and 4 in the other, and carried them over to Zeus's refrigerator.
  

""You give me hope, challenger! Perhaps someone will be able to complete my challenges after all. The feats increase in difficulty, of course, so be prepared for this next one! I have lodged my sword in this slab of granite. Retrieve the sword for me and I will present you the final challenge."" The hero begins to pull on the sword, and it is very difficult. He notices the sword wiggle slightly, which gives him just enough confidence to unlodge the sword using most of his might. He presents the sword to Zeus.
  

""Hero, you have completed the first 3 trials and only one remains. No mortal man has made it this far, and it is as far as Hercules, Chuck Norris, and all the great heroes have made it; but none have succeeded. Complete this, and you shall have a seat in the legendary Pantheon.
  

Zeus holds out his hand and says “crack this closed pistachio please”",1562554338.0,Zeus is offering a seat in his Pantheon to one who can complete his trials of strength.
t3_ca67dl,22,Jokes,Seamen,1562501708.0,What does a gay shark eat?
t3_ca5pc7,16,Jokes,It was like music to my arse,1562497605.0,When I heard that a cure for dyslexia had been discovered
t3_cai2z9,5,Jokes,She'll kill me if she finds out.,1562571780.0,My girlfriend is a porn star.
t3_caejga,1,Jokes,"""Who's there?""

""An interrupting southerner""

""An interrupti-""

""Actually it was about states' rights!""",1562548112.0,*knock knock*
t3_caedht,1,Jokes,"He looked at me, with a surprised look on his face.",1562547107.0,I told someone in public they drew their eyebrows on too high today
t3_cagyqp,1,Jokes,Boba Fed,1562563505.0,What do you call a guy who only eats bubble tea balls?
