id,num_comments,subreddit,text,time_created,title
t3_c9mfrq,2,Jokes,"Cop:  Did you see the robbers?

Witness:  Sort of.  There were three guys wearing ski masks and an elephant.

Cop:  An elephant?!

Witness:  Yeah, an elephant.

Cop:  Was it an African or Indian elephant?

Witness:  I didn't ask where it was from.

Cop:  No, African elephants have large ears, while Indian elephants are relatively small.  So, what type was it?

Witness:  How should I know?  It was wearing a ski mask, too!",1562367479.0,A cop was interviewing a witness to a bank robbery...
t3_c9ridt,0,Jokes,"The doctor examines the lump closely then responds, ""looks benign to me.""

The man looks down, shrugs, then replies, ""b'nine... B'nine and a half.""

(Joke shamelessly ripped from Scrubs.)",1562403227.0,A man discovers he has a lump on his penis while showering so he decides to go to the doctors.
t3_c9k7ca,4,Jokes,"First you get a little hoarse, then you get a little buggy.",1562355513.0,Did you hear about the Amish flu?
t3_c9rhb7,1,Jokes,"A small tree begins to grow between them,and the beech says to the birch,

""Is that a son of a beech or a son of a birch?""

The birch says he can not tell,but just then a woodpecker lands on the sapling.The birch say's to the woodpecker,""Hey woodpecker,you're an expert in trees.Can you tell if that sapling you landed on is a son of a beech or a son of a birch?""

The woodpecker takes a taste of the small tree and replies,""It's neither a son of a beech or a son of a birch.It is,however,the best piece of Ash I have ever poked my pecker into.""",1562402949.0,"Two tall trees,a birch and a beech, are growing in the woods."
t3_c9rgz4,3,Jokes,\-She,1562402870.0,"""that's what"""
t3_c9nrhr,4,Jokes,I told them to bug off. My dog doesn't have a bike.,1562375697.0,The police showed up at my door and claimed my dog chased a man down the street on a bike.
t3_c9om9v,2,Jokes,Cumpassion,1562381232.0,What is it called when a man feels bad for squirting on a woman?
t3_c9n91x,3,Jokes," Boss: Congratulations! I'm promoting you to manage our Montreal office!   
 

Young man (disappointed): But sir! There's nothing up there but bar girls and hockey players.   
 

Boss (now insulted): I'll have you know that MY MOTHER is from Montreal!   
 

Young man (thinking fast): No kidding? What hockey team did she play on?",1562372391.0,Promotion
t3_c9ower,6,Jokes,would be pointless.,1562383053.0,Life without geometry
t3_c9ied3,2,Jokes,"The worker is baffled by the question and says no. He walks in the next day and asks if they have carrot ice cream, again the worker replies no. The shop owner decides that if he wants carrot ice cream so bad they should make some. The man walks in the next day and asks, ""Do you have carrot ice cream?"" The worker happily replies yes. ""That's fucking gross."" says the man and leaves the shop.",1562346311.0,A man walks into a ice cream shop and asks if they have carrot ice cream.
t3_c9u3yd,0,Jokes,He's supposedly fucking dead now.,1562422984.0,Have you heard about the incestuous necrophiliac who was buried with his parents in the family crypt?
t3_c9jek9,5,Jokes,"A fireman knocks on his door and says, ""You need to come with me, there's a flood coming.""

The christian says, ""No, no, I'm a faithful christian, God will save me.""

The fireman leaves and the flood waters come in. Eventually the flood waters get so high that he has to move to the first floor of his house.

A lifeboat goes by his house and the man at the front of it says, ""Get on, we're here to help you.""

The christian says, ""No, no, I'm a faithful christian, God will save me.""

The lifeboat leaves and, in a few minutes, the water has risen so much that he has to move to his roof.

A helicopter evetually flies in and the pilot yells on the megaphone. ""Come on, we must evacuate!""

The christian shouts, ""No, no, I'm a faithful christian, God will save me.""

The christian dies in the flood, and when he gets to heaven, he says to God, ""I've been a faithful christian all my life, why didn't you save me?""

God then says, ""I sent you a fireman, a lifeboat, and a helicopter. What more help do you need?""",1562351367.0,A christian hears that there is a flood coming to his town. (long)
t3_c9mm5n,3,Jokes,Barbed wire,1562368521.0,What do you get when an hedgehog and a Snake make a child
t3_c9u20u,4,Jokes,Me neither.,1562422669.0,Have you ever heard a gay guy fart?
t3_c9u0bu,4,Jokes,Cary,1562422388.0,What do you call a guy with no arms or legs?
t3_c9wi42,3,Jokes,Hard boiled egg eaters!,1562435829.0,Do you know who don’t like hard boiled egg lovers?
t3_c9hpx0,2,Jokes,**Get yer cock out of me booty!**,1562342902.0,What did the pirate captain say when he caught his first mate hiding a rooster in his treasure chest?
t3_c9mqwq,3,Jokes,Scientists have found the gene that makes people shy. They found it hiding behind another gene.,1562369311.0,Medical joke (short)
t3_c9xzu5,2,Jokes,83 cents,1562443615.0,What do you call a white rapper?
t3_c9s2nu,5,Jokes,"""Your captain is Miss Mary Joystick....""  


""You mean to tell me this plane is being piloted by a woman?""asked an alarmed passenger to a stewardess.""  


""Yes, sir,"" replied the stewardess. ""So is the co-pilot, Miss Jane Understudy. So also are the radio operator and the navigator, they are all women in command.""  


""I must see this for myself,"" said the passenger. ""Please take me to the cockpit.""  


""We don't call it that any more, sir!""",1562408191.0,"As the aircraft was taxiing towards the runway to take off, the voice on the speaker welcomed passengers on board and introduced them to the pilot."
t3_c9i0j2,1,Jokes,"
....Whoever has it is spending far less than what my wife usually does.",1562344435.0,My credit card got stolen 3 months ago and I still haven’t reported it missing.....
t3_c9tvx8,1,Jokes,Freedom rings.,1562421644.0,What do you call the concentric clouds around a nuclear explosion?
t3_c9yy02,3,Jokes,Those who understand binary and those who don’t.,1562448637.0,There are exactly 10 types of people in this world.
t3_c9s0r4,1,Jokes,Buzz.,1562407742.0,What do you get if you cross a bee hive with an electrical pylon?
t3_c9tt4f,7,Jokes,XXX,1562421137.0,What's the dirtiest number?
t3_c9pbb1,0,Jokes,There's more geese in that line.,1562386077.0,When geese fly south in a V formation. One line is always longer. You know why?
t3_c9nth0,1,Jokes,It was a desserted island.,1562376035.0,"Why did the shipwrecked pirates get to eat cakes, cookies and pies when they washed up on shore?"
t3_c9oh3k,1,Jokes,Nobody knows.,1562380291.0,What do you call a person without a body or a nose?
t3_c9tr8w,2,Jokes,It ain't gonna build itself!,1562420786.0,I think it's high time we build a Von Neumann machine. C'mon!
t3_c9p9du,3,Jokes,A pilot you racist fuck,1562385725.0,What do you call a black man flying an airplane
t3_c9n76h,4,Jokes,"Color me impressed...

I didn’t know you could lead a horticulture",1562372080.0,You wife was a stripper and now teaches gardening classes...
t3_c98d60,64,Jokes,"The only question asked was: ""Would you please give your honest opinion about solutions to the food shortage in the rest of the world?"" The survey was a huge flop.

In Africa they didn't know what ""food"" meant. In Eastern Europe, they didn't know what ""honest"" meant.

In Western Europe, they didn't know what ""shortage"" meant. In China, they didn't know what ""opinion"" meant.

In the Middle East, they didn't know what ""solution"" meant.

In South America, they didn't know what ""please"" meant.

And in the USA, they didn't know what ""the rest of the world"" meant.",1562278168.0,The UN decided to do a worldwide survey...
t3_c9nosd,3,Jokes,Well it made Bud wiser,1562375219.0,Can beer make you smarter?
t3_c9w0b3,0,Jokes,It's sooooooo hard,1562433295.0,Have you ever tried the 8 hour erection challenge?
t3_c9oof2,0,Jokes,The competition is stiff,1562381611.0,Did you hear about the new pill that's going up against Viagra?
t3_c9nwug,4,Jokes,"Some people watch it

Weirdos video tape it

And  some people furiously masturbate to it",1562376639.0,Fireworks are like sex
t3_c9rt94,3,Jokes,"Because it was dead.               
            
...              
                
You have to be a dog to get it.",1562405905.0,Why did the cat fall out of the tree?
t3_c9thym,0,Jokes,"The evening water was glistening and the skies above hadn't a single cloud. Suddenly a huge bolt of lightning flashed above them and illuminated what felt like the whole ocean. Susan, being terrified, screamed, 

""Steve! Let's get out of here, you and I both know we can't survive a lightning strike!"" 

Steve replied,

""Silly Susan, that can't possibly be lightning. See how there are no clouds on this beautiful night? It was probably nothing.""

Worried that their fish-date was ruined, Steve figures that being extra romantic might comfort Susan and perhaps save the evening.

""Oh Susan, when the light of the moon hits your eye like a big pizza pie-""

A second bright flash cut him off. Susan, pointing behind Steve, yelped,

""That's a moray!""",1562419085.0,"[Terrible OC] Two fish, Susan and Steve, were on a fish-date"
t3_c9rr59,4,Jokes,"I can only remember the general gist of the joke was about a person who the doctors cut open and find a smaller person inside, and it goes on like that for a while. Then the person ends up becoming smaller than the atoms themselves
It hasn't really got a punch line.
There's something to do with them burying the person in the end because they become so small that nobody even knows they're there.

It's like a woman starts to slowly harden or something and the doctors are baffled. They think she's dead so they cut her open and find there's a smaller version of her inside, she's the exact same in every way, just smaller.
And it keeps happening.

Apologies if this is the wrong place to ask but it's driving me insane.

Thanks.",1562405371.0,Trying to remember a joke
t3_c9cmcn,17,Jokes,"
 ''My friend is dead! What should I do?"" 

The operator replies, ""Calm down sir, first make sure that he's really dead.""

 There's a silence, then a loud bang. Back on the phone, the guy says, Ok, now what?",1562307925.0,Two hunters are out in the woods when one of them collapses. He's not breathing so his friend calls 911
t3_c9b6an,20,Jokes,"Passengers: *start freaking out*

Pilot: all of us will one day, no one knows when!

Passengers: *sigh with relief* 

Pilot: but it'll probably be when we hit this mountain!!",1562297307.0,Pilot: *over intercom* we’re all gonna die!
t3_c9khzu,1,Jokes,"A couple days later, the town drunk was walking through the cemetery and heard some strange noise coming from the area where Beethoven was buried. Terrified, the drunk ran and got the priest to come and listen to it. The priest bent close to the grave and heard some faint, unrecognizable music coming from the grave. Frightened, the priest ran and got the town magistrate.  


When the magistrate arrived, he bent his ear to the grave, listened for a moment, and said, ""Ah, yes, that's Beethoven's Ninth Symphony, being played backwards.""  


He listened a while longer, and said, ""There's the Eighth Symphony, and it's backwards, too. Most puzzling."" So the magistrate kept listening; ""There's the Seventh... the Sixth... the Fifth...""  


Suddenly the realization of what was happening dawned on the magistrate; he stood up and announced to the crowd that had gathered in the cemetery, ""My fellow citizens, there's nothing to worry about. It's just Beethoven decomposing.""",1562357014.0,"When Beethoven passed away, he was buried in a churchyard."
t3_c9rnom,0,Jokes,"The following is a joke I have heard for most of my life; there was a similar one on here from a while back, though:

&amp;#x200B;

&amp;#x200B;

&amp;#x200B;

A yankee goes down to south Louisiana and wants to go duck hunting. He pays and goes duck hunting and says to his guide, ""man that was fun, and that's a mighty fine dog, I oughtta get one.""

&amp;#x200B;

His guide, the sly cajun he is, says, ""Oh, but now son, that ain't no ordinary dog; and you better know they may try and rip you off.""

&amp;#x200B;

He says, ""really?""

&amp;#x200B;

The guide, with sincerity, returns, ""Boudreaux here is a duck dog--he's special made so he can't sink.""

&amp;#x200B;

The man, surprised says, ""Really!? he looks like an ordinary dog! how can you tell?""

&amp;#x200B;

The guide squats down by the dog and motions with his finger, ""come here son."" And the man stoops down also. He lifts up his tail and points, saying, ""See how small his butt-hole is?""

&amp;#x200B;

The man, intrigued, says, ""Yeah?\`"" And the guide explains, ""A duck-dogs butt-hole is real small so he can't fill up with water and drown, you hear that?""

&amp;#x200B;

The man perks up and shouts, ""yeah, man, thanks!"" The two shake, and the man heads off, going to get a dog the next day before he leaves.

&amp;#x200B;

As he drives through town, he sees a sign up, ""dogs for sale,"" and he goes and checks'em out. He examines each dog, waiting for someone to come see him. Tibideaux walks up and with a look of horror and shock on his face, says, as calmly as he can, ""Man, what are you doin'!?""

&amp;#x200B;

The man says, ""see, sir, I need a duck dog,""

&amp;#x200B;

Perplexed, Tibideaux says, ""You need you a duck dog?""

&amp;#x200B;

He says, ""Yeah, and I really like this one, but all these, their butt-holes are too big--they'll fill up with water and drown.""

&amp;#x200B;

Tibideaux's gets a look of shock as he realises what's going on and his face lights up, with a great gasp, he says long-drawn-out and sincere-like, ""Ohhh, I see. No, these is convertable!""

&amp;#x200B;

""Uhh... convertible?""

&amp;#x200B;

Tibideaux stoops down and lifts the dogs tail and points, saying, ""see how big his butt-hole is? he'll feel up with a bunch a water.""

&amp;#x200B;

""Yeah""

&amp;#x200B;

""watch this,"" Tibideaux grabs the dog's balls and spins'em around, and dog's butt-hole puckers up real small with a yelp, and says, ""See, now he's in hydro-mode!""",1562404492.0,A Yankee Goes Duck Hunting....
t3_c9nzwv,5,Jokes,"Me: Why did the chicken cross the road?

Me: To get to the idiots house.

Me: Knock knock.

You: Who’s there?

Me: The chicken.

You: Fuck off",1562377181.0,"I know this is cheesy, but hear me out."
t3_c9x4aj,0,Jokes,Because he got kicked in the nuggets.,1562438991.0,Why didnt the rooster cross the road?
t3_c9ecu7,5,Jokes,OP delivers.,1562321929.0,"After a long search, I finally got a job with FedEx."
t3_c9jjqd,6,Jokes,"We were both hanging around, having a nice time together. Then suddenly out of a blue, a guy came up to us, holding a lighter in his hand. He looked awfully fishy and he gave us a strange stare. 


""Hey, boys. Ya mind if I ask ya a question?""


""What is it?"" My brother asked, unperturbed by the man's strange behaviour.


""I just wanted to know... you two know each other well?"" He raised his eyebrow.


""What? Of course we do!"" I replied, confused.


""I see, I see..."" The man nodded his head mysteriously. ""Lemme guess... you're related? Siblings, maybe?""


""Yeah, you got it. Why do you ask?"" My brother asked, now as perplexed as I was.


""Heh, it's nothing. It's just as I thought, huh..."" The man took his lighter and turned it on.


""Wait, what the hell are you doing with that thing?"" I asked, a bit nervous now. The man didn't respond. Instead, he took his lit lighter towards us. We both backed away, but he approached us.


Soon, we had to call for help. It was clear this man was trying to burn us, for whatever reason. Thankfully, the other mallgoers nearby heard our cries and managed to come and get him away from us. He still tried to approach us, however.


""Sir, put the lighter down!""


""You're going to hurt them!""


""Wait, wait! Why're you guys tryna stop me?"" The man asked. ""Is it wrong for a man to try and smoke now?""


""Smoke?!"" I cried out. ""What the hell?! Are we just cigarettes to you?!""


The man then looked me in the eye clearly.


""Yeah. I thought you just said you were mall-bros, sonny.""",1562352103.0,My brother and I both went to the mall today.
t3_c9kgs1,2,Jokes, I spent 2 years of my life training for nothing.,1562356839.0,I just found out that cock fighting is between 2 chickens.
t3_c9ys55,7,Jokes,When we are tan we and getting cooked and when we burn we are cook ready for the world to eat us,1562447766.0,The sun is slowly cooking us
t3_c9o503,0,Jokes,It's call Illbhard,1562378119.0,Ubisoft's has a new subsidiary that only makes adult games
t3_c9rfmy,3,Jokes,Geese,1562402540.0,_______ bet you can’t have just one!
t3_c9l74t,2,Jokes,My wife said I was Tolkien in my sleep.,1562360605.0,"Last night, I had a dream that I wrote the Lord of the Rings books."
t3_c9o2xw,1,Jokes,He didn't speak English.,1562377749.0,Did you know that Hitler never said sorry to anybody in his entire life?
t3_c9iqbi,4,Jokes,"Father Tom was approached by Dave, who had been a regular churchgoer for years, but had recently been missing service. Father Tom asked him if everything was okay, as he had missed several services over the last few months. Dave told Father Tom ""I've been working non-stop trying to save my business. I'm about to miss paying my workers' salary and I'm about to be evicted from the house my grandfather left me from missing mortgage payments.""

Father Tom told him ""I'm very sorry to hear that. One thing that has always helped me in times of trouble is this. Go home, pull out your Bible. Close your eyes, turn to a random page, and place your finger on it, and God will direct you to the message you need to hear.""

Dave was out the following three weeks, but when he returned the fourth week, Father Tom was amazed to see him driving a brand new sports car, wearing a suit that had to have been custom made.

After the service, Father Tom rushed up to Dave and asked him what had happened. Dave told him ""Father, I did exactly what you said. I pulled out the family Bible, closed my eyes, and pointed to a random place on a random page. And the words God sent to me were the most helpful message I've ever heard. Chapter Eleven.""",1562347984.0,"One Sunday after church,"
t3_c9pkk2,2,Jokes,Because they know their way around Uranus.,1562388106.0,Why would proctologists make good astronauts?
t3_c9qa7i,1,Jokes,"He's not really quick, but every now and then he gets up and leaves the room for no reason.",1562393337.0,My neighbor has cat-like reflexes
t3_c9ia6j,4,Jokes,"when Sherlock Homes suddenly stopped.

""Dear God.  I just stepped on something brown and icky.  Tell me Watson, was it mud?""

Watson looked back at what Holmes stepped on and said ""No. Shit Sherlock"".",1562345744.0,Sherlock Holmes and Watson were walking home one night
t3_c9o9k5,2,Jokes,unless said immediately after a blow job,1562378909.0,"""You can suck a dick"" is an insult"
t3_c9osbm,0,Jokes,I’m not sure.... but the steaks are high,1562382310.0,Who’s gonna win the cow weed smoking competition?
t3_c9m18i,4,Jokes,They couldn't see eye to eye.,1562365128.0,A tall woman and a short man broke-up
t3_c9eypj,4,Jokes,"A priest, a minister, and a rabbi wanted to find out who’s best at his job. So they decide that each of them will go into the woods, find a bear and attempt to convert it. 
Later that day, they get together. The priest begins: “I found a bear sitting by a tree. I blessed him and sprinkled him with holy water. Next week is his first communion.” 
The minister says, “I found a bear by a stream and preached God’s holy word. The bear was so mesmerized that he let me baptize him.” 
They both look at the rabbi, who is all scratched and bruised and with his clothes torn to shreds. The rabbi looks at them and says, “Maybe I shouldn't have started with the circumcision.”",1562326698.0,"A priest, a minister and a rabbi."
t3_c9mj5i,3,Jokes,That was the last time I put my ass on the line for him.,1562368007.0,My friend once dared me to take a shit on electrified train tracks.
t3_c9onxn,2,Jokes,"Because Oct 31 = Dec 25

-----

^Can't ^remember ^where ^I ^heard ^it ^before",1562381519.0,Why did the programmer buy a Jack O' Lantern on Christmas Day?
t3_c9o3sl,3,Jokes,"The horse reared and the cowboy drew his six-gun to shoot the snake. ""Hold on there, partner,"" said the snake, ""don't shoot - I'm an enchanted rattlesnake, and if you don't shoot me, I'll give you any three wishes you want.""

The cowboy decided to take a chance. He knew he was safely out of the snake's striking range. He said, ""Okay, first, I'd like to have a face like Clark Gable, then, I'd like a build like Arnold Schwarzenegger, and finally, I'd like sexual equipment like this here horse I'm riding.""

The rattlesnake said, ""All right, when you get back to the bunk house you'll have all three wishes."" The cowboy turned his horse around and galloped at full speed all the way to the bunk house. He dismounted on the run and went straight inside to the mirror.

Staring back at him in the mirror was the face of Clark Gable. He ripped the shirt off his back and revealed bulging, rippling muscles, just like Arnold Schwarzenegger. Really excited now, he tore down his jeans, looked at his crotch and shouted, ""Oh my God, I was riding the mare!""",1562377906.0,"It was spring in the old west. The cowboys rode the still snow-choked trails looking for cattle that survived the winter. As one cowboy's horse went around the narrow trail, it came upon a rattlesnake warming itself in the spring sunshine."
t3_c9olep,1,Jokes,Dad: No problem Alan,1562381066.0,Son: Why is my sister called Teresa? Dad: Coz your mum loves Easter - it's an anagram Son: Thanks dad
t3_c9f7xb,1,Jokes,"His father asks ""what are the good news, son?""

""I'm getting married"", the young man responds.

""Wow! That is great! Amazing! Congratulations!"", his dad exclaims, almost in tears. ""So, who are you marrying?"", he asks.

""I'm marrying Ashley"", the young man responds.

""Oh that crazy slut"", the dad says at once.

""What??"" The young man says, surprised. ""I can't believe you just said that about my future wife!"", he says, and storms out of the house and goes to the backyard, completely angry at this father.

In the backyard he finds his mother attending to the garden, who notices that something's wrong and asks, ""What's wrong, dear?""

""Nothing's wrong"", says the young man. ""Just had an argument with dad. I gave him great news and he was kind of disrespectful, anyways, it doesn't matter, it's in the past now"", he says.

""What are these great news?"", the mother asks.

""I'm getting married"", he responds.

""That is great! Congratulations son!"", says the mother as she hugs him. ""So, who's the lucky girl?"", she asks.

""It's Ashley"", the man responds.

""A real whore, that one"", says the mother.

""Wait. What???"", says the young man. ""You too, just like dad!"", he shouts in anger.

So the young man, totally irritated gets out of there and starts walking down the street. After a few minutes walking, he notices his friends hanging out at a bar, and so he decides it might be a good idea to join them, have a few drinks and forget about the incidents at home.

After greeting his friends, they ask him what's new, and he says ""I'm getting married"".

""Congratulations"", his friends exclaim. ""That is amazing!"", says another one. Another one shouts to the bartender ""please get us a round of beers, all on me, for the gentleman here that is getting married!"". ""Yeah!"", everyone cheers.

""So, who are you marrying?"", one of them asks.

""I'm marrying Ashley"", our young man responds.

""Oh that tramp"", says one of the guys. ""A real crazy slut"", says another one.

""Whattt????"", the man says. ""You too? Just like my parents? Fuck everyone!"" he says, as he leaves the bar extremely annoyed.

He keeps walking down the street and enters the church. There the priest greets him, ""Hi son! How are you doing? I haven't seen you in years! What brings you to the House of God?""

""I want to know what's the process necessary to get married. No one seems to approve but I'll get married anyways"", the man says, still clearly irritated.

""That's great!"", the priest responds. ""But before discussing any further, at least let me know who you are marrying"", the priest asks.

""It doesn't matter"", the man responds. ""Let's say I'm marrying the biggest tramp, the sluttiest girl in town"", he says.

""Oh really?"", the priest says. ""You are marrying Ashley?""",1562328510.0,A young man goes to his dad and tells him that he's got great news
t3_c9ypf2,3,Jokes,Drinks and Drives,1562447362.0,What was the name of the Native American that died in a car crash?
t3_c9o0hd,2,Jokes,but I think we all know it's a historical reference by now.,1562377293.0,I've always wondered about the inspiration for the band name Jefferson Airplane
t3_c9x63g,2,Jokes,"No? Oh yeah, it hasn’t come out yet.",1562439253.0,Have you seen the movie constipation?
t3_c9h8rj,4,Jokes,"The man, peeking out the window, scoffs to himself as he thinks “just one? All these idiots are going the wrong way!”",1562340497.0,A man was driving down highway 407 when a radio announcer said: “be warned of a car driving the wrong way along the highway”
t3_c9n2m4,4,Jokes,"The bartender asks, ""Why the saggy face?""

It became sad, so it decided to go to another bar. The blobfish is asked ""Why the saggy face?"" again, so it decides to go to another bar. However, the blobfish slowly began to return to normal. When he had already visited 15 bars, he was back to normal.

-----

**^Note:** ^bar ^as ^in ^atmospheric ^pressure",1562371315.0,An blobfish walks into 1 bar.
t3_c9gulc,1,Jokes,Collecting money for the government is taxing,1562338446.0,Why is the IRS always tired?
