id,num_comments,subreddit,text,time_created,title
t3_ca14q5,3,Jokes,"He sits at the counter, and notices an old cowboy with his arms folded, staring blankly at a full bowl of chowder.

After fifteen minutes of just sitting there staring at it, the young cowboy bravely asked the old cowboy, “If you ain’t gonna eat that, do ya mind if I do?”

The older cowboy slowly turns his head toward the young wrangler and in his best cowboy manner says, “Nah, go ahead”.

Eagerly, the young cowboy reaches over and slides the bowl over to his place and starts spooning in it with delight.

He gets nearly down to the bottom and notices a dead mouse.

The sight was shocking and he immediately barfs up the chowder back into the bowl.

The old cowboy quietly says, “Yep, that’s as far as I got, too”",1562461520.0,A young cowboy walks into the saloon in a rough and dusty Western town in Texas.
t3_ca3e2w,0,Jokes,"India.


Credit to my little friend.",1562477007.0,Where would migrant cows seek refuge?
t3_ca290g,5,Jokes,A buccaneer.,1562468874.0,How much money do pirates pay for corn?
t3_ca0yxd,0,Jokes,Now I'm HOV Positive.,1562460487.0,I had sex in the carpool lane...
t3_ca0uzq,1,Jokes,"1st child: mom, why did you name me Lilly?

Mom: because when I was walking out of the hospital with you, a lily flower pedal landed on your head.

2nd child: why did you name me rose?

Mom: because when I was walking out of the hospital with you, a rose pedal landed on your head

Third child: didhdhsbsufbdbshdbd

Mom: shut up brick",1562459788.0,Three kids and a mom are having a conversation
t3_ca6btp,0,Jokes,"The priest it is, on an infant so dear.",1562502673.0,Who rides there so late through the night dark and drear?
t3_c9zvft,3,Jokes,Now he is a master of marshal arts.,1562453900.0,My blackbelt karate teacher has honed his skill of painting high ranking military officials for years
t3_ca9zvf,12,Jokes,"Two pig famers were sitting at the bar next to eachother and one is complaining about the lack of women. The other one agrees and says ""I don't need women for sex"". The other one is confused and asked ""why?"".

""Well, if I'm in need I go to my pigs stall and choose one"". ""Maybe you should try it"".

Two weeks later in the same bar they meet again and the other is curious about it and asked ""And?!  Did you tried it? How was it?""

The pig farmer answered ""complete disaster!"". The other farmer asked ""How come?! Did you do as I said?"".

""Well, said the farmer, ""I went in and tried  to get the pig on his back"". ""But it rolled back at her side, again and again"". The other says "" no, no, no you kneel down behind it as it stands!"". 

The farmer says"" if I going to have sex with it, I wanna kiss it too"".",1562523572.0,Two farmers
t3_c9yt48,8,Jokes,That’s me in the corner!,1562447908.0,I just had a photo taken with REM...
t3_c9xyu4,3,Jokes,Math puns make me feel number,1562443469.0,Puns make me feel numb
t3_c9s47g,2,Jokes,"The doctor comes back with the results and says ""Physically you are both fit as fiddles for your age. However mentally you are both beginning to lose it a bit. My suggestion for now is write things down when you think of them, that way you can keep on top of your to-do's"".

So they go home, relatively happy. As they are relaxing in the living room watching TV, the man gets up and walks towards the kitchen. He turns to his wife and asks ""Would you like anything from the kitchen dear"".

She replies ""Oo yes please, can I have some ice cream?""

""Sure thing"" says the husband. 

""Dont you think you should follow the doctors advice and write it down?"" Asks the wife.

""Nah I'll remember it honey"" he says.

""But I'd like strawberries with it too"" 

""Okay"" he says ""but I dont need to write it down, I'll remember it""

The wife says ""but I'd also like whipped cream with it too"".

""Yep, not a problem"" he says.

""Are you sure you don't want to write this down?"" She asks, concerned.

""I'll remember it all, don't you worry"" he replies and goes into the kitchen. 

He's in the kitchen for a good 20 minutes and just as the wife starts to wonder what hes doing, he comes through the door with a plate of sausages, bacon and eggs.

She looks at the plate with a mixture of confusion and annoyance. She then looks at him, frowns and says ""where's my toast?""",1562408577.0,An 80yr old couple go to the doctors for a routine check up.
t3_ca2gc4,1,Jokes,"  
  
Because it was an ill eagle.",1562470254.0,Why couldn't the eagle fly out of the country?
t3_ca3seb,0,Jokes,I was in High Spirits!,1562480207.0,"I was sad, So I drank two bottles of Whiskey and smoked twnty Joints and immediately felt happy.."
t3_ca1gbt,1,Jokes,"The host asks the blonde what 2+2 is.

""3"" yells the blonde.

""I'm afraid that's the wrong answer"" replies the host.

The whole crowd yells in unison: ""give her another chance, give her another chance!""

The host says: ""ok I'll give you another try: what's 2+2?""

The blonde this time says: ""5"".

The host is disappointed again and the crowd again yells: ""give her another chance, give her another chance!""

The host then says: ""last try: what's 2+2?""

This time the blonde says 4 and the crowd claps except for one blonde in the audience.

She screams: ""give her another chance, give her another chance!""",1562463625.0,A blonde is participating in a gameshow
t3_ca00vb,0,Jokes,ImPeck-able,1562454770.0,"just witnessed a chicken try and pick up a piece of corn for 5 minutes,"
t3_ca3ql2,3,Jokes,A Nazi,1562479801.0,What do you call a blind German?
t3_c9tpd7,5,Jokes,They’re really shady.,1562420449.0,Why shouldn’t you go near big trees?
t3_c9zczi,3,Jokes,Godzilla!  (Can someone explain this to me?  My 8-year-old told it to me and was really proud of it.),1562450937.0,Why potato ding dong?
t3_ca2bhv,2,Jokes,I don't recall applying for a job,1562469346.0,Apparently the police want to interview me.
t3_ca0ta5,2,Jokes,They take too much for granite,1562459506.0,Why should stone masons not be given a lot of money/materials to work with?
t3_ca4g41,0,Jokes,I can't believe Gaviscon.,1562486104.0,I am finding it really hard to get over my friend dying of heart burn.
t3_c9z9gb,3,Jokes,...if it isn’t autocorrect.,1562450389.0,we’ll we’ll we’ll...
t3_cac0cp,2,Jokes,"He was supposed to go shopping, but he didn't come back",1562533706.0,Been waiting 23 years for my dad to come home.
t3_ca3dxb,3,Jokes,he thought the book was better.,1562476972.0,"A mormon went to see “The Book of Mormon”,"
t3_c9yiyh,2,Jokes,Nice belt,1562446432.0,What did 0 say to 8?
t3_c9um6n,2,Jokes,The shit hit the fan.,1562425864.0,Guess what happened when the rockstar threw feces at the audience.
t3_ca5op9,0,Jokes,They both lilo,1562497452.0,What does a Spy and an inflatable pool floatie have in common
t3_ca1t9j,4,Jokes,Calculust,1562465969.0,What makes a mathematician horny?
t3_c9zmcm,7,Jokes,It just doesn't make cents,1562452418.0,Why do we keep making pennies when the cost to make them is more than their value?
t3_ca47an,0,Jokes,"You could say I was ""bummed out"" about it.",1562483820.0,There was a rip in my dress showing my buttcheek
t3_ca0s01,0,Jokes,"It's always ""honey do this"" and ""honey do that""",1562459285.0,"My wife's most recent obsession is growing melons, and she makes me help her in the garden."
t3_ca0ado,3,Jokes,Because he’s two squared,1562456325.0,Why didn’t the number 4 go skydiving?
t3_ca169o,6,Jokes,"What did the high sandwich say when it came out of the oven?





Im baaaaked 





This was stupid, bye.",1562461772.0,I just made this up!
t3_ca34vv,5,Jokes,He was committing fraud.,1562475076.0,God was arrested while working at the bank.
t3_ca5jzt,1,Jokes,Does that mean The Sperm Race was a tie?,1562496315.0,If a new mother has twins
t3_ca05qm,0,Jokes,He can drive his golf ball 300 yards without hitting a tree.,1562455572.0,What’s the difference between Tiger Woods’s golf ball and his SUV?
t3_ca0hgv,0,Jokes,"At the reception, the old folks always came to me telling: ""You're next! You're next!""

This suddenly stopped after I started doing the same at funeral services.",1562457507.0,I attended many weddings in the past within my extended family.
t3_c9w983,13,Jokes,"When you are Rick rolled and go ""Hey, I love this song!""",1562434575.0,How can you tell you are an 80's kid?
t3_c9xfd1,3,Jokes,A mechanic,1562440573.0,What do you call an Amish man with his hand up a horses ass?
t3_ca1el4,1,Jokes,So I use a walkie-talkie instead.,1562463297.0,I refuse to drive while on a cellphone and break the law.
t3_c9x8fd,5,Jokes,"He sees an older genteleman, standing by his bed, who asks him ""How tall are you, son?""

The man replies "" Five foot ten, doctor""

The older man, looking confused, says ""Oh, I'm not the doctor, I'm the carpenter""",1562439594.0,A young man wakes up in a hospital.
t3_ca0ott,2,Jokes,Your mom slipped over it.,1562458722.0,Scientists found out that the cause for the California earthquake was not a divine retribution but simply a banana peel.
t3_ca9etj,2,Jokes,Meow’lad.,1562520695.0,What does a kitten call its dad?
t3_ca8b4u,2,Jokes,"The first hooker says, ""Last night I had a doctor. He was great to deal with and he paid me very well.""

The second hooker says, ""I had a lawyer last night. He was to-the-point and the pay was great.""

The third hooker says ""Well I had a farmer last night. First he complained it was too dry, then he complained it was too wet, and when we were done he asked me for a free hat.""",1562514892.0,Three hookers meet for breakfast and are visiting about last night's clientele ...
t3_ca1u95,0,Jokes,"I understood why, it would probably be too harsh for me to hear.",1562466160.0,My parents always said “I can’t tell you how much I love you.”
t3_ca57bw,2,Jokes,"They walked in backwards, Poland thought they were leaving.",1562493150.0,How did Germany invade Poland?
t3_ca5729,1,Jokes,"They are just bunch of jamaicans who misread it as "" Dis I Like"".",1562493072.0,I've Finally found out why people still dislike good quality content in youtube.
t3_ca55s5,4,Jokes,you look lesBIEN,1562492749.0,"Hey girl, you don't just look ""good"""
t3_ca3mpg,2,Jokes,"Person 1: Knock Knock

Person 2: Who's there?

Person 1: Schmel Mipe

Person 2: Schmel Mipe who?",1562478921.0,Schmel Mipe
t3_ca0g4z,1,Jokes,"She said, “Where would you find the time?”

Me: Easy. Right next to the sage.",1562457285.0,I told my wife that I’ll start arranging the herbs in alphabetical order from now on.
t3_c9e25k,1355,Jokes,"I asked my 10 brothers and sisters, but they don’t know either.",1562319536.0,What did our parents do to kill boredom before the internet?
t3_ca2itj,1,Jokes,"Cop- Where are you headed?  What do you do for a living? Who’s car is this?

Miner- mine",1562470724.0,A Cop Pulls Over A Car
t3_ca3kqe,0,Jokes,"Everyone’s fucked each other, and they’re all paying way too much money to be there.",1562478488.0,The suburbs are like Greek Row for adults.
t3_ca2elo,5,Jokes,Areola Grande,1562469937.0,What do you call Ariana Grande with big nipples?
t3_c9zbtb,3,Jokes,"A Blonde, Brunette, and a Redhead were stranded in a island 50 miles away from land.

They all decided that they would swim to land. 

The Brunette swims 13 miles and drowns. 

The Redhead swims 26 miles and drowns. 

The Blonde swims 25 miles gets tired and swims back to the island.",1562450751.0,"A Blonde, Brunette, and a Redhead were stranded in a island."
t3_ca3ex6,1,Jokes,"Every time he leaves for lunch break, he says ""I'll be in the Jim.""",1562477194.0,I think my gay co-worker has a lot of sex.
t3_ca0ry8,0,Jokes,"After a few drinks, the giraffe falls over and dies. The man begins to walk out till the bartender stops him

""Hey you can't leave that lyin' there"" the bartender shouts 

The man looks back and says ""it's not a lion. It's a giraffe.""",1562459276.0,A man and a giraffe walk into a bar
t3_c9z5q6,0,Jokes,"I said to her ‘Sorry,i am seeing someone’.",1562449807.0,A blind woman asked me out last night.
t3_ca4vtc,0,Jokes,One baby in two cribs.,1562490205.0,What's worse than two babies in a crib?
t3_c9xlz4,2,Jokes,It's full of vitamin bee!,1562441560.0,Why is honey good for you?
t3_c9xwzu,0,Jokes,"Teacher: Is Jeff here?

Jeff: Yes!

Teacher: And Geoff?

Geoff: Yeos!",1562443210.0,"Teacher: Ok, I'm going to take attendance"
t3_c9s9d1,1,Jokes,"He has difficulty communicating with the pharmacist, and cannot see condoms on the shelf.  


Frustrated, the deaf-mute finally unzips his pants, places his dick on the counter, and puts down a five dollar bill next to it.  


The pharmacist unzips his pants, does the same as the deaf- mute, and then picks up both bills and stuffs them in his pocket.  


Exasperated, the deaf mute begins to curse the pharmacist wildly in sign language.  


""Look,"" the pharmacist says, ""if you can't afford to lose, you shouldn't bet.""",1562409845.0,A Deaf mute walks into pharmacy to buy condoms.
t3_c9wf75,3,Jokes,I’d have two dollars and a hundred counterfeits.,1562435414.0,If I had a dollar for every gender...
t3_ca4ral,4,Jokes,You got a warm welcome.,1562489031.0,What happened when you arrived at Auschwitz with a cold?
t3_c9zu8c,2,Jokes,They're out standing in their field.,1562453700.0,You know cows..
t3_c9slak,4,Jokes,HAND EEEEEEEEEEEEYEEEEEEEEEE,1562412587.0,What's Whitney Houston's favorite type of coordination?
t3_ca32rb,0,Jokes,"
1) ""who's there?""

2)  ""Wu""

1) ""Wu who?

2) ""I'm excited to see you too bro... Woohoo""",1562474637.0,Knock knock
t3_c9qu2x,6,Jokes,...until your mom sat on it.,1562397459.0,"I wasn't always a Flat Earther. In fact, I used to believe the Earth was round..."
t3_c9zomm,0,Jokes,"I don’t know, but apparently they use Charmin.",1562452773.0,Where do bears shit in the woods?
t3_ca30ph,2,Jokes,Friends call me Hydrogen.,1562474199.0,My name is Bond.
t3_c9n7y9,18,Jokes,"  
 

I just think he’s mean.",1562372209.0,My son’s math teacher called him average...
t3_c9s3op,9,Jokes,Im trans-slender,1562408445.0,Im fat but i identify as skinny
t3_ca2w1f,5,Jokes,"He sounded real upset and was stuttering, so I asked if he was alright 

Larry: N-o, n-not r-eally...

Me: What's wrong?

Larry: W-ell, l-ast n-ight I w-as w-as w-atching t-v w-ith m-y g-irlfriend a-nd t-t-the d-og w-as i-n f-ront i-tching i-t's b-ack, s-o I a-sked m-y g-irlfriend i-f s-he w-anted m-e t-o d-o t-o h-er wh-what t-t-the d-og w-as d-oing t-o i-tself, a-nd s-he s-lapped m-e!

Me: I don't understand, why would she do that?

Larry: B-y t-t-the t-ime I w-as d-one a-sking h-er t-hat, t-t-the d-og h-ad s-tart l-apping i-ts a-ss!",1562473257.0,My friend Larry called me the other day
t3_c9xmki,0,Jokes,"
Lettuce pray",1562441649.0,What did the religious salad say?
t3_c9yfz0,0,Jokes,The Third Rake,1562445999.0,What do you call it when a garden shed supports the Nazi movement?
t3_ca0sdi,0,Jokes,Log((ne)^co),1562459349.0,What's the worst smelling math problem?
t3_c9rfam,21,Jokes,He serves no real purpose but it would make me smile to push him down some stairs.,1562402451.0,"A good nickname for Donald Trump would be ""Slinky"""
t3_ca1lc0,1,Jokes,I'll tell you tomorrow.,1562464528.0,Do you know how to keep a fool in suspense?
t3_ca7131,2,Jokes,...Round.,1562507454.0,"My wife is mad because I (5’2”, 450lbs) won’t get in shape. That’s a lie, I’m in a perfectly good shape..."
t3_ca1k24,2,Jokes,You can beat an egg but you can’t fucking beat a wank.,1562464287.0,What’s the difference between an egg and a wank?
t3_c9zbom,1,Jokes,"If a mother laughs at dad’s jokes, we have guests.",1562450731.0,A child’s observation:
t3_ca8p2p,3,Jokes,They can’t think straight.,1562517006.0,Why are gay people autistic?
t3_c9vev0,0,Jokes,I’ll tell you it later,1562430159.0,I have a joke about procrastination
t3_c9y6c5,2,Jokes,"As soon as he sits down he sees a very attractive woman sitting across from him in the next booth. “Surely she is waiting for someone.” thought the man. “There is no way someone that attractive could be eating alone.”

Well the meal goes on and no one shows up to sit with the attractive woman. They had made some eye contact but never for long and the man was trying to get up the nerve to go talk to her. All of a sudden the woman sneeze and her glass eye comes shooting out of her head and bounces on the mans table and right into his hands.

Not really sure what to do the man walks over to the lady and offers her the glass eye back. Small talk soon turns into some engaging conversation. The man is thrilled! She eventually asks the man if he would want to go to a bar after they finish their meal and the man jumps at the chance to go. 

They get to the bar and they are having a great time. Eventually the woman asks the man if he would want to dance. Of course the man says yes and they enjoy the dance floor and each other’s company. 

After they had a wonderful time on the dance floor the woman invites the man back to her place for a night cap and the man stays the night.

He wakes up and is lying next to the beautiful woman who slowly stirs awake. The man just stared at the beautiful woman and wondered how he got so lucky. Out of curiosity he eventually asks the girl “why me?”

“Oh” said the attractive woman. “That’s easy, you were just the first one to catch my eye.”",1562444588.0,A man sits down alone at a restaurant.
t3_c9y5zj,2,Jokes,"Probably ""First""",1562444535.0,I wonder what the first human being ever said.
t3_c9wyv5,7,Jokes,I don't know. They can't see shit.,1562438215.0,How does a blind person know when they're finished wiping their butt?
t3_c9u87r,4,Jokes,But a few snakes were rattled.,1562423683.0,Fortunately the California earthquakes were a bit out in the desert so not many people got hurt.
t3_c9uosl,1,Jokes,"Batman: Have you checked the battery?

Robin: Tery what?",1562426279.0,Robin: The Batmobile isn't working.
t3_c9wwx0,0,Jokes,"said Aurora , age 3.",1562437948.0,"The English Women's world cup team visited an orphanage. ""They looked helpless. They had a lack of hope in their eyes...."""
t3_ca4axv,5,Jokes,Explosives,1562484734.0,"A is 4 apple, B is 4 ball, what is C 4?"
t3_ca4aw3,1,Jokes,Because they did Nazi it coming,1562484720.0,Why was Poland taken completely off guard when Germany attacked them in WW2?
t3_c9wv94,0,Jokes,"Doctor: Well, everyone is going to die eventually.

Man: Everyone?? Holy shit, what have I done?",1562437708.0,"Man: Doctor, I accidentally swallowed one of those “Do not Eat” silica packets. Am I going to die?"
t3_c9zoij,1,Jokes,"


Defendant: procrastination.",1562452758.0,Judge: why did you kill your wife after 30 years of marriage?
t3_ca48ur,1,Jokes,Absolute zero,1562484203.0,What did the lazy chemist get on his test?
t3_c9t924,3,Jokes,"There has been a study at Cambridge University to determine why men have a knob (glans) on the end of of their dicks.

They spent £1.000.000 and announced that it is there to give women pleasure.

When Oxford uni saw this they did some research, cost £2.000.000 and determined that it is to give men pleasure.

Brighton Uni spent £50.00 and said it is there to stop your hand slipping off the end.",1562417431.0,Glans
t3_c9yd8c,2,Jokes,And two other Japanese words.,1562445584.0,"In two weeks I Masters Ninjitsu, Karate, Judo..."
t3_c9s1k7,18,Jokes,My family take Monopoly way too seriously.,1562407938.0,I was raped in jail today.
t3_c9zjk4,1,Jokes,I was just as confused when it started getting smaller.,1562451981.0,I couldn't figure out why the boomerang was getting bigger
t3_c9qwcv,9,Jokes,Because he was in the middle of 9-11,1562397954.0,"Why was ""ten"" always scared?"
t3_ca09ho,8,Jokes,He was the butt of all my jokes,1562456185.0,I used to do stand up comedy with former WWE Superstar Rikishi
t3_ca2ceu,0,Jokes,He wanted to be coached by a Doc instead of a Nurse,1562469516.0,Why did Kawhi choose the Clippers instead of the Raptors?
t3_ca43v6,0,Jokes,"The Cuban pulls out a Cuban cigar for each person, and hands it out. The Cuban takes one puff of his cigar, and he throws it out the window. Everybody but the Cuban goes mad. ¨You just wasted an expensive Cuban cigar! How could you?¨ The Cuban simply says, ¨See, in Cuba, cigars are very cheap.¨ The other passengers are reassured and respond with, ¨Oh, OK.¨

The Russian takes out a small bottle of Russian vodka and pours a shot for all the passengers. The Russian downs his shot, and throws the vodka bottle out the window. The rest of the passengers are alarmed, once again. ¨You just destroyed an expensive bottle of Russian vodka! How could you?¨ The Russian simply states, ¨See, in Russia, vodka is very cheap.¨ Yet again, the other passengers are reassured and respond with, ¨Ah, yes! Of course.¨

The American scratches his head and goes, ¨I think I see the pattern here.¨ So he takes the lawyer, and he throws him out the window!¨",1562482988.0,"An American, a Cuban, a Russian, and a lawyer are sitting on a subway train, in the same seat."
t3_c9zgax,0,Jokes,"Well, on the one hand",1562451460.0,How does someone who lost an arm starts an argument?
t3_ca13hd,0,Jokes,Today I got mugged by a pair of Siamese twins. The police said I was just seeing double.,1562461302.0,I got mugged
t3_ca134o,5,Jokes,Everything :),1562461240.0,What do you deserve and is also a type of bagel?
t3_ca42a5,0,Jokes,Juan,1562482603.0,How many Mexicans does it take to change a light bulb?
t3_c9ylho,0,Jokes,I think he might be running a Fonzi scheme.,1562446814.0,"My investment banker used all of my money to buy a leather jacket and a motorcycle, and when I asked for it back he told me to 'sit on it'."
t3_ca23dv,8,Jokes,"They both fight cling ons around your anus

(Klingons around Uranus)",1562467835.0,What do Captain Curt and toilet paper have in common?
t3_c9vm0n,4,Jokes,But she figured out I was only after my money!,1562431217.0,I tried to re-marry my ex-wife...
t3_c9tw5o,0,Jokes,I think it's rad,1562421691.0,So I was playing one of the old fallout games
t3_c9urqv,4,Jokes,Do not spoil the answer,1562426737.0,Why Ironman and why not Fe-male?
t3_c9zr8m,1,Jokes,"The topic of vacation comes up and the barista says, ""I don't have a lot saved up, so I think I'm going to stick around town this year and just take it easy.""

The viking chimes in, ""I'm going to take my ship out with my mates and raid the lands to the south."" The other two look a bit shocked.

The veterinarian says, ""I really want to give back this year so I'm going to do volunteer work with stray animals in South America.""

Just then, the waiter who overheard the conversation approaches: ""So it sounds like it's going to be a staycation, a slaycation, and a spaycation.""",1562453212.0,"A barista, a viking, and a veterinarian are getting dinner together."
t3_c9wcqf,2,Jokes,And I would never make a joke about such a straight thing.,1562435069.0,Being a member of the LGBTQ+ community is completely normal.
t3_c9vcow,4,Jokes,B (top view)  oo (front view)  b side view.,1562429851.0,The word Boob is actually a diagram.
t3_c9y6nu,12,Jokes,"He said: ""now you're 910""",1562444637.0,A drunk guy killed a cop then called 911
t3_cabqiz,2,Jokes,mr obama stole my 2009 toyota corolla cheeky bastard AHHHHH IM ANGRY thank you for listening gru from minions is 14ft tall,1562532330.0,barack obama
t3_c9y3oz,1,Jokes,"For example, a kid napping.",1562444197.0,"You know, under the right context, a kidnapping has the potential to be a very serene experience"
t3_ca3lrb,3,Jokes,Because they are so dense.,1562478706.0,Scientists predict that the racists of this world may well form a black hole in the distant future.
t3_ca0end,1,Jokes,Enemy,1562457039.0,What do you call the troops directly behind the French army's front line?
t3_c9xcp3,0,Jokes,Neigh Boars,1562440188.0,What do you call the pigs that live next to horses?
t3_ca3jcg,3,Jokes,she caused a bigger earthquake than you!,1562478179.0,Yo momma so fat...
t3_ca1lqv,1,Jokes,She sucks the fun out of it,1562464608.0,I don't really like oral
t3_c9rtr3,2,Jokes,"“Well,” says Lucas, “every night before I climb into bed with a girl, I whack my penis on the bed three times. It works, and it sure impresses the girls!”

James was excited at this easy suggestion and decided to try it that very night. So before climbing into bed with his wife, he took out his penis and whacked it three times on the bed.

His wife, half-asleep, said, “Lucas? Is that you?”",1562406040.0,"James is in the bathroom shaving when the kid he hired to mow his lawn, a local kid named Lucas, comes in to pee. He slyly looks over and is shocked at how supersize Lucas penis is. He can’t help himself, and asks him what his secret is."
t3_c9qk0g,6,Jokes,"Me: You just did

You: I’m not gonna do that

Me: This joke only makes sense if you read it backwards",1562395283.0,You: Bastard
t3_c9pzoy,9,Jokes,Would be a lot cooler if he did,1562391123.0,Donald Trump doesn't believe in global warming
t3_c9yeh1,3,Jokes,Dracola,1562445777.0,What's a vampire's favourite beverage?
t3_ca01y7,4,Jokes,"""Can I see your license please?""

""What does that look like?"" says the blonde driver.

""It's small, rectangular in shape, and has your picture on it."" replies the blonde officer.

The blonde driver looks through her purse for a while and pulls out a small rectangular mirror.

The blonde police officer looks at it and says: ""My bad, I didn't know you were a police officer too. Sorry to bother you."" and let's her go.",1562454949.0,A blonde police officer pulls over a blonde driver.
